{
  "big_task_id": "bt-example",
  "charter_revision": "charter-2",
  "completed_task_ids": [
    "task-a"
  ],
  "cursors": {
    "command_cursor": {
      "available": true,
      "count": 4,
      "last_id": "cmd-4"
    },
    "event_cursor": {
      "available": true,
      "count": 0,
      "last_id": null
    },
    "operation_cursor": {
      "available": true,
      "count": 2,
      "last_id": "op-2"
    },
    "state_version": 12
  },
  "decisions": [
    {
      "decision_id": "dec-1",
      "outcome": "APPROVED_BOUNDED_SCOPE",
      "scope": "phase_sequencing"
    }
  ],
  "delegation_revision": "deleg-3",
  "dependencies": [
    {
      "dependency_id": "dep-1",
      "kind": "sequence",
      "on": "task-a"
    }
  ],
  "evidence_refs": [
    {
      "id": "ev-commit-1",
      "kind": "commit",
      "sha256": "aaaaaaaaaaaaaaaaaaaaaaaaaaaaaaaaaaaaaaaaaaaaaaaaaaaaaaaaaaaaaaaa"
    },
    {
      "id": "ev-tests-1",
      "kind": "test_run",
      "sha256": "bbbbbbbbbbbbbbbbbbbbbbbbbbbbbbbbbbbbbbbbbbbbbbbbbbbbbbbbbbbbbbbb"
    }
  ],
  "generation": 1,
  "last_committed_state_version": 12,
  "ownership": {
    "files": [
      "packages/example/src/index.ts"
    ],
    "workers": [
      {
        "route_id": "agy_flash_high",
        "task_id": "task-b",
        "worker_id": "w-1"
      }
    ],
    "worktrees": [
      {
        "branch": "agent/task-b",
        "worker_id": "w-1",
        "worktree_id": "wt-1"
      }
    ]
  },
  "risks": [
    {
      "risk_id": "risk-1",
      "status": "OPEN",
      "summary": "integration ordering"
    }
  ],
  "run_id": "run-example",
  "schema_version": "1.0",
  "state_digest": "1219496b6fe0ac2380a53d010dbf7276e5516cf67dcbea4d3ae25af5866e9e5e",
  "task_graph": [
    {
      "depends_on": [],
      "status": "COMPLETE",
      "task_id": "task-a"
    },
    {
      "depends_on": [
        "task-a"
      ],
      "status": "RUNNING",
      "task_id": "task-b"
    }
  ],
  "task_id": "task-example",
  "task_lead_id": "tl-example"
}
